{
  "schema_version": "harness-module/v0",
  "module_id": "alpha-cycle",
  "kind": "capability",
  "description": "Dependency cycle fixture A.",
  "default_activation": false,
  "dependencies": { "kernel_api": "v1", "modules": ["beta-cycle"] },
  "requested_capabilities": ["filesystem-read"],
  "ownership": {
    "owned_paths": ["tests/fixtures/tk02/cycle/alpha-cycle/module.manifest.json"],
    "watch_paths": []
  },
  "entrypoints": { "commands": [], "hooks": [] },
  "validation": {
    "owner_tests": ["tests/verify-hashing-module.ps1"],
    "quick": [],
    "core_group": null,
    "changed": [],
    "full": []
  }
}
