{
  "schema_version": "harness-module/v0",
  "module_id": "beta-module",
  "kind": "capability",
  "description": "Valid dependent module fixture.",
  "default_activation": false,
  "dependencies": { "kernel_api": "v1", "modules": ["alpha-module"] },
  "requested_capabilities": ["filesystem-read"],
  "ownership": {
    "owned_paths": ["tests/fixtures/tk02/valid/beta-module/module.manifest.json"],
    "watch_paths": []
  },
  "entrypoints": { "commands": [], "hooks": [] },
  "validation": {
    "owner_tests": ["tests/verify-canonical-json.ps1"],
    "quick": [],
    "core_group": null,
    "changed": [],
    "full": ["tests/verify-canonical-json.ps1"]
  }
}
