{
  "schema_version": "harness-module/v0",
  "module_id": "alpha-module",
  "kind": "kernel",
  "description": "Duplicate module identity fixture A.",
  "default_activation": true,
  "dependencies": { "kernel_api": "v1", "modules": [] },
  "requested_capabilities": ["filesystem-read"],
  "ownership": {
    "owned_paths": ["tests/fixtures/tk02/duplicate-id/alpha-module/module.manifest.json"],
    "watch_paths": []
  },
  "entrypoints": { "commands": [], "hooks": [] },
  "validation": {
    "owner_tests": ["tests/verify-hashing-module.ps1"],
    "quick": [],
    "core_group": null,
    "changed": [],
    "full": []
  }
}
